{
  "$": 1,
  "n": "@core/consent",
  "v": "1.0.0",
  "s": {
    "en": "GDPR cookie consent: banner with equal reject/accept, categories, proof records, ConsentGate and Google Consent Mode v2",
    "es": "Consentimiento de cookies RGPD: banner con rechazar igual de visible, categorías, registro de prueba, ConsentGate y Consent Mode v2",
    "pt-BR": "Consentimento de cookies LGPD/RGPD: banner com recusar igual a aceitar, categorias, registro de prova e Consent Mode v2",
    "fr": "Consentement cookies RGPD : bandeau refuser/accepter à égalité, catégories, preuve, ConsentGate et Consent Mode v2",
    "de": "DSGVO-Cookie-Einwilligung: Banner mit gleichwertigem Ablehnen, Kategorien, Nachweis, ConsentGate und Consent Mode v2",
    "ja": "GDPR クッキー同意：拒否と同意を同等に扱うバナー、カテゴリ、同意記録、ConsentGate、Consent Mode v2",
    "zh-CN": "GDPR Cookie 同意：拒绝与接受同等显著的横幅、分类、同意记录、ConsentGate 和 Consent Mode v2",
    "ko": "GDPR 쿠키 동의: 거부·동의가 동등한 배너, 카테고리, 동의 기록, ConsentGate, Consent Mode v2"
  },
  "d": "src/lib/consent",
  "l": "MIT",
  "k": [
    "gdpr",
    "cookies",
    "consent",
    "privacy",
    "analytics"
  ],
  "g": {
    "@core/db": "^1.0.0"
  },
  "p": {
    "zod": "^4.0.0",
    "react": "^19.0.0"
  },
  "e": [
    "CONSENT_POLICY_VERSION"
  ]
}
